{
  "$schema": "https://json-schema.org/draft/2020-12/schema",
  "$id": "https://getmaipai.github.io/home/spec/schemas/open-question.schema.json",
  "title": "OpenQuestion",
  "description": "SPEC-01, folded in by the coherence review, 2026-09-14 (question 1, 'Four ask slots'): one of four ask mechanisms named across the design pass, the only one that needed its own record. `PendingAsk` (turnEngine.ts) is consumed by the very next utterance and stays a hub-internal field, not this. This is the OTHER kind: a question the hub wants to ask a specific person, not necessarily right now and not necessarily in the conversation that raised it - the judge's own open question about an unconfirmed inference (ASK-01 part 4), a `relay` queued for a household adult by AGE-01's `defer` move, a `clarify_fact` from a contradiction (CRED-01). Keyed by person, asked once at the end of that person's next reply on ANY conversation, then cleared - spec-shaped because the robot asks the same questions the hub queues. Replaces the earlier conversations.open_question column design (ASK-01's own draft), which this record supersedes before that column is ever built.",
  "type": "object",
  "additionalProperties": false,
  "required": ["id", "person", "conversation_id", "kind", "text", "status", "source", "created_at", "hlc"],
  "properties": {
    "id": { "type": "string", "pattern": "^oq-[a-z0-9]{6,}$" },
    "person": {
      "type": "string",
      "pattern": "^person-[a-z0-9]{6,}$",
      "description": "Who the question is asked OF, next time they speak - not necessarily who or what the question is about."
    },
    "conversation_id": {
      "type": ["string", "null"],
      "pattern": "^conv-[a-z0-9]{6,}$",
      "default": null,
      "description": "The conversation this question arose from, when there is one to point back to. Asking happens on the person's NEXT reply on any conversation (the whole reason this is keyed by person, not by conversation), so this is provenance, not a constraint on where it gets asked."
    },
    "kind": {
      "type": "string",
      "enum": ["who", "clarify_fact", "relay"],
      "description": "who: an unconfirmed inference's own open question (ASK-01 part 4, 'is Alex your partner?'). clarify_fact: CRED-01's one clarification after a contradiction. relay: AGE-01's defer move, 'want me to tell them you asked?', queued for an adult on the child's behalf."
    },
    "text": { "type": "string", "minLength": 1, "description": "The question, in the household's own words, asked verbatim - never re-generated at ask time." },
    "subject_id": {
      "type": ["string", "null"],
      "pattern": "^(ent|rel)-[a-z0-9]{6,}$",
      "default": null,
      "description": "The entity or relationship this question is about, when there is one (an inferred relationship's own confirm, a contradicted memory record's subject entity). Null for a question with no single record behind it."
    },
    "status": {
      "type": "string",
      "enum": ["pending", "asked", "answered", "declined", "expired"],
      "default": "pending",
      "description": "pending: queued, not yet asked. asked: appended to a reply, awaiting the person's next turn. answered/declined: the person responded either way. expired: never asked or answered within the household's own retention (a stale open question does not accumulate forever)."
    },
    "source": {
      "type": "string",
      "minLength": 1,
      "description": "Free-text provenance (a turn id, a judge run id), matching memory-record.schema.json's own `source` field's convention."
    },
    "created_at": { "type": "string", "format": "date-time" },
    "asked_at": { "type": ["string", "null"], "format": "date-time", "default": null },
    "resolved_at": { "type": ["string", "null"], "format": "date-time", "default": null },
    "hlc": {
      "type": "string",
      "pattern": "^[0-9]+:[0-9]+:[a-z0-9]{6,}$",
      "description": "Hybrid logical clock: wall_ms:counter:node (7.3), the same shape every other synced record type uses."
    }
  }
}
